[
  {"schema_revision":"0.1.0","source_id":"SRC-NV5-ML-20261019","title":"NV5 Maximum Likelihood algorithm","source_type":"official","url":"https://www.nv5geospatialsoftware.com/docs/MaximumLikelihood.html","locator":"Maximum Likelihood Classification; equal priors and threshold probability","software_version":"Online documentation 6.3; local task probe 5.6 recorded separately","retrieved_at":"2026-10-19","access_scope":"full_text","review_status":"candidate","snapshot_sha256":null},
  {"schema_revision":"0.1.0","source_id":"SRC-NV5-ML-TASK-20261019","title":"NV5 MaximumLikelihoodClassification task","source_type":"official","url":"https://www.nv5geospatialsoftware.com/docs/ENVIMaximumLikelihoodClassificationTask.html","locator":"MEAN, COVARIANCE, THRESHOLD_PROBABILITY parameters and version history","software_version":"Online current documentation; do not assume local 5.6 parameter parity","retrieved_at":"2026-10-19","access_scope":"full_text","review_status":"candidate","snapshot_sha256":null},
  {"schema_revision":"0.1.0","source_id":"SRC-NV5-SMOOTH-20261019","title":"NV5 ClassificationSmoothing task","source_type":"official","url":"https://www.nv5geospatialsoftware.com/docs/enviclassificationsmoothingtask.html","locator":"KERNEL_SIZE and majority analysis description","software_version":"Online current documentation; local 5.6 KERNEL_SIZE probed","retrieved_at":"2026-10-19","access_scope":"full_text","review_status":"candidate","snapshot_sha256":null}
]
